id,es,en
WL58,"El quorum sensing es la capacidad que tienen algunas bacterias para comunicarse entre sí e inducir procesos a nivel poblacional mediante la producción y secreción de ciertas moléculas frente a un estímulo determinado,","Quorum sensing is the ability of some bacteria to communicate with each other and induce processes at the population level by producing and secreting certain molecules in response to a given stimulus,"
WL59,como por ejemplo es producir algún pigmento o molécula fluorescente.,such as producing a pigment or fluorescent molecule.
WL60,¡Espero haberme explicado bien!,I hope I made myself clear!
WL61,Algo que siempre me ha fascinado es el quorum sensing. ¿Te gustaría saber en qué consiste?,"Something that has always fascinated me is quorum sensing, would you like to know what it is?"
WL62,El quorum sensing es un proceso mediante el cual las bacterias pueden comunicarse entre sí y regular algunas de sus actividades en función de la densidad de población de bacterias.,Quorum sensing is a process by which bacteria can communicate with each other and regulate some of their activities depending on the bacterial population density.
WL63,Este fenómeno se basa en que las bacterias de determinadas especies producen y liberan unas moléculas que actúan como señales y que reciben el nombre de autoinductores.,This phenomenon is based on the fact that bacteria of certain species produce and release molecules that act as signals and are called autoinducers.
WL64,"Cuando la densidad de la población es baja y hay pocas bacterias produciendo estas moléculas,","When the population density is low and there are few bacteria producing these molecules,"
WL65,no hay suficiente concentración y no se genera ninguna respuesta por parte de las células.,there is not enough concentration and no response is generated by the cells.
WL66,"Sin embargo, cuando la densidad de población supera un límite, la gran cantidad de bacterias produciendo autoinductores hace que estos alcancen grandes concentraciones,","However, when the population density exceeds a limit, the large number of bacteria producing autoinducers causes them to reach high concentrations,"
WL67,"suficientes para disparar una respuesta en la célula, activando procesos concretos.","enough to trigger a response in the cell, activating specific processes."
WL68,"Por ejemplo, las bacterias emplean esta estrategia de comunicación para iniciar la producción de bioluminiscencia, la virulencia o la reproducción.","For example, bacteria use this communication strategy to initiate bioluminescence production, virulence or reproduction."
WL69,"¡Si tienes ganas de aprender más, habla conmigo!","If you want to learn more, talk to me!"
WL70,"Te he visto hablando con mi compañero… creo haberle oído hablar de lo que hacemos en Wetlab, pero sería importante que te contase un poco lo que vamos a hacer.","I saw you talking to my colleague... I think I heard him talking about what we do in Wetlab, but it would be important to tell you a bit about what we are going to do."
WL71,"Ahora que contamos con los fragmentos de ADN que vamos a utilizar, tenemos que unirlos en un orden concreto para generar la construcción génica completa, es decir, ensamblar los fragmentos.","Now that we have the DNA fragments we are going to use, we have to put them together in a particular order to generate the complete gene construct, i.e. assemble the fragments."
WL72,"Para ello aplicamos 2 técnicas fundamentales: digestión y ligación, que nos van a permitir cortar los fragmentos de ADN y posteriormente pegarlos unos tras otros.","To do this, we apply two fundamental techniques: digestion and ligation, which allow us to cut the DNA fragments and then glue them together."
WL73,"La construcción génica se debe introducir dentro de otra molécula de ADN, llamada plásmido, para que podamos introducir el ADN dentro de un organismo que lo pueda captar, como una bacteria.","The gene construct must be introduced into another DNA molecule, called a plasmid, so that we can introduce the DNA into an organism that can take it up, such as a bacterium."
WL74,El proceso mediante el cual las bacterias son capaces de incorporar nuestro plásmido recibe el nombre de transformación.,The process by which bacteria are able to incorporate our plasmid is called transformation.
WL75,"Si conseguimos todo esto, tendremos una bacteria con nuestra construcción génica de interés y podremos comprobar si realiza la función que nosotros queremos correctamente.","If we do all this, we will have a bacterium with our gene construct of interest and we will be able to test whether it performs the function we want it to correctly."
WL76,"Suena muy complicado, ¿seguro que yo soy el más indicado para hacer esto?","It sounds very complicated, are you sure I'm the best person to do this?"
WL77,"¡No te preocupes, ya verás como le pillas el truco a los protocolos enseguida!","Don't worry, you'll catch up with the protocols in no time!"
WL78,¿Quieres aprender un poco sobre qué son las enzimas de restricción?,Do you want to learn a bit about restriction enzymes?
WL79,"Las enzimas de restricción son proteínas que tienen la capacidad de cortar el ADN sobre secuencias específicas. Por ejemplo, la enzima EcoRI corta siempre que encuentre la secuencia GAATTC en el ADN.","Restriction enzymes are proteins that have the ability to cut DNA at specific sequences. For example, the EcoRI enzyme cuts whenever it finds the sequence GAATTC in DNA."
WL80,Las enzimas de restricción forman parte de un sistema de defensa de las bacterias contra los virus.,Restriction enzymes are part of a bacterial defence system against viruses.
WL81,"Sin embargo, pronto los investigadores las han aplicado a la ingeniería genética, al ser capaces de cortar fragmentos de ADN dejando en ellos extremos que permiten unir unas secuencias con otras de forma específica.","However, researchers have soon applied them to genetic engineering, as they are able to cut fragments of DNA, leaving DNA ends that allow sequences to be linked to other sequences in a specific way."
WL82,¿No es interesante?,Isn't that interesting?
WL83,¡Vuelve a hablarme si cambias de opinión!,Talk to me again if you change your mind!
W1,(¿¡Están sentados en el suelo sin hacer nada!?),(Are they just sitting on the floor doing nothing?!)
W2,"Disculpad, ¿es esta la sala de Wiki?","Excuse me, is this the Wiki room?"
W3,"¿Erm? S-sí, sí es aquí.","Erm? Y-yes, yes this is it."
W4,¿Y usted es?,And you are?
W5,Soy un nuevo miembro que acaba de entrar al equipo.,I'm a new member who just joined the team.
W6,"Umm, ya veo…","Umm, I see..."
W7,"Una pregunta, si no es molestia…","One question, if you don't mind..."
W8,¿Qué hacéis ahí tirados en el suelo?,What are you guys doing lying there on the ground?
W9,Pues cómo solo quedan 5 minutos para que acabe la competición y nadie nos ha entregado nada…,"Well, since there's only 5 minutes left in the competition and no one has handed us anything..."
W10,Hemos decidido aceptar nuestro fracaso aquí sentaditos.,We've decided to accept our failure by sitting here.
W11,A-ah ya veo.,A-ah I see.
W12,Sí.,Yes.
W13,…,…
W14,Pero es que os he traído las cosas.,But I brought you the stuff.
W15,¿¡A ESTAS ALTURAS!?,AT THIS POINT?!
W16,Perdonad pero lo hemos hecho lo más rápido posible…,Sorry but we did it as quickly as possible...
W17,(Aunque he de decir que acabo de llegar…),(Although I have to say I've only just arrived...)
W18,¡Rápido dame los documentos!,Quickly give me the documents!
W19,*click clack clack click clack*,*click clack clack click clack*
W20,¡No me va a dar tiempo a mí solo!,I won't be able to do it alone!
W21,¡No se preocupe jefe!,Don't worry boss!
W22,"¡Nosotros le daremos un curso rápido de HTML, CSS y JavaScript intensivo, y podremos trabajar los cuatro!","We'll give you a crash course in HTML, CSS and JavaScript, and the four of us can work together!"
W23,...,…
W24,¡Se acabó!,It's over!
W25,¡HEMOS ACABADO EL PROYECTO!,WE'VE FINISHED THE PROJECT!
W26,¡AHHHH! ¡No me lo puedo creer!,AHHHHH! I can't believe it!
W27,"Después de tanto esfuerzo, por fin acabamos el trabajo…","After so much effort, we've finally finished the job..."
W28,¡Por un momento creía que se venía abajo todo!,For a moment I thought it was all going to collapse!
W29,Menos mal que nos has salvado.,Thank goodness you saved us.
W30,¡Me alegra haber sido de ayuda!,I'm glad I could help!
W31,"Además, ¡he aprendido un montón!","Besides, I learned a lot!"
W32,"Bueno, aún no hemos terminado del todo.","Well, we're not quite done yet."
W33,Todavía nos queda ir a la final y que valoren nuestro trabajo.,We still have to go to the final and have our work judged.
W34,¡Por fin nuestros esfuerzos serán recompensados!,Finally our efforts will be rewarded!
W35,¡No hay tiempo!,There's no time!
W36,¡Se me van a borrar las huellas dactilares de teclear tan rápido!,I'm going to wipe my fingerprints off from typing so fast!
W37,¡Solo queda un minuto para que se acabe el plazo!,Only one minute left before the deadline!
W38,¡Vamos a entregar el proyecto finalmente!,Let's finally deliver the project!
W39,¿Estás listo?,Are you ready?
W40,A-ah entiendo…,A-ah I get it...
W41,B-bueno vuelve cuando estés listo…,W-well come back when you're ready...
W42,"Pero tampoco tardes mucho, ¿vale?","But don't take too long either, okay?"
W43,¡Muchas gracias por tu ayuda!,Thank you so much for your help!
W44,"Si no estuvieras ahí, no podríamos haber acabado a tiempo.","If you weren't there, we couldn't have finished on time."
W45,En este grupo nos encargamos de recoger la información sobre todo el proyecto y plasmarla en Internet.,In this group we are in charge of collecting information about the whole project and putting it on the internet.
W46,Específicamente en una “wiki”. Una wiki es una página simple creada con la idea de plasmar cierta información y enlazarla a otras páginas web.,Specifically in a ‘wiki’. A wiki is a simple web page created with the idea of capturing certain information and linking it to other web pages.
W47,"Todo proyecto de biología sintética debe quedar perfectamente explicado en algún lado,","Every synthetic biology project must be perfectly explained somewhere,"
W48,"y en nuestro caso, usamos la wiki, para que sea fácil de entender tanto por el público inexperto como por los más puestos en el tema.","and in our case, we use the wiki, so that it is easy to understand both for the inexperienced public and for those who are more knowledgeable about the subject."
W49,"¡Es fundamental que toda la información relacionada con la biología sintética sea accesible para todo el mundo, y más siendo un campo tan novedoso!","It is essential that all information related to synthetic biology is accessible to everyone, especially in such a new field!"
W50,"Entiendo, así todo el que quiera trabajar en el campo podrá hacerlo con más facilidad…","I understand, so that everyone who wants to work in the field can do it easily..."
W51,"Recuerda, las wikis son muy útiles para plasmar la investigación en biología sintética de forma accesible y sencilla.","Remember, wikis are very useful for making synthetic biology research accessible and easy to use."
W52,¡Lo hemos conseguido!,We did it!
W53,Déjame que te explique lo que vamos a hacer ahora.,Let me explain what we are going to do now.
W54,"Ya tenemos los textos que deben estar en la página web, así que lo único que nos queda por hacer es meterlos.","We already have the texts that need to be on the website, so the only thing left to do is to put them in."
W55,¿Y es eso muy difícil?,And is that very difficult?
W56,"No, solo debes tener conocimientos básicos sobre qué son los “lenguajes de marcado” y de “estilo en cascada”.","No, you just need to have a basic knowledge of what ‘layout languages’ are."
W57,¿Eso tiene algo que ver con HTML?,Does that have anything to do with HTML?
W58,¡Así es!,That's right!
W59,"Estos lenguajes sirven para crear a través de varios elementos gráficos una interfaz fácil de usar,","A layout language is a language used by a programmer to create through various graphical elements a user-friendly interface,"
W60,o simplemente organizarlos de tal forma que sean visualmente agradables.,or simply to arrange them in such a way that they are visually pleasing.
W61,HTML y CSS son dos ejemplos muy conocidos.,HTML and CSS are two well-known examples.
W62,¡Comprendo!,I understand!
W63,¡Ahora que ya sabes qué vamos a hacer (más o menos) tenemos que ayudar al jefe!,Now that you know what we are going to do (more or less) we have to help the boss!
W64,¡Por fin hemos acabado!,We're finally done!
W65,¡BUAAAAAAAA!,WUAAAAAAAA!
W66,¿Estás bien? ¿Por qué lloras?,"Are you okay, why are you crying?"
W67,¡Si por fin hemos acabado!,We're finally done!
W68,¡P-por eso lloroooo!,Th-that's why I'm crying!
W69,¡Lloro de alegría!,I'm crying for joy!
W70,(¿Supongo que entonces no pasa nada?),(I guess it's all right then?)
W71,¡Por fin la gente sabrá más sobre la biología sintética!,Finally people will know more about synthetic biology!
W72,"Espero que este proyecto pueda ayudar a mucha gente, ¡tocará publicarlo en redes!","I hope this project can help a lot of people, I will post it on networks!"
W73,¡Qué alegría que todo haya salido bien!,I'm glad it all worked out!
W74,Ahora solo queda ver qué opinan sobre nuestro trabajo.,Now we just need to see what you think of our work.
W75,¡Muchas gracias por todo!,Thank you very much for everything!
W76,¿Has disfrutado trabajando en un equipo de biología sintética?,Have you enjoyed working on a synthetic biology team?
W77,¡Sí! He aprendido mucho de muchas disciplinas distintas.,"Yes, I have learned a lot from many different disciplines."
W78,¡Me alegro de oírlo!,Glad to hear it!
WLKDL,Bienvenido al juego de Drylab,Welcome to the game of Drylab
IMJDL1,"¡Llegó la hora de obtener las secuencias de ADN necesarias para elaborar las construcciones genéticas y poder desarrollar nuestro proyecto! Para ello, recoge los elementos génicos que caen de la parte superior de la pantalla como te ha dicho Metionino,el jefe de Drylab. Pero recuerda, el orden es muy importante para que las construcciones sean funcionales, así que asegúrate de coger las piezas en el orden correcto.","It's time to gather the DNA sequences necessary for the production of the genetic constructs and the development of our project. For this purpose, gather the genetic elements that fall from the top of the screen.\nBut remember, the order is very important for the constructions to be functional, so make sure to collect the pieces in the correct order."
IMJDL2,"Consigue el mayor número de construcciones genéticas: [color=green]gana[/color] 3 puntos por cada constructo génico completado, [color=green]gana[/color] 1 punto por cada pieza correcta recogida en el momento adecuado, pero [color=red]pierde[/color] 1 puntos si te equivocas de orden. ¡Siempre puedes comprobar tu progreso en la barra de la parte superior de la pantalla!","Collect the most number of genetic constructs: gain 3 points per genetic construct completed, earn I point per piece collected in the correct moment, but lose I point if you make a mistake in the order. You can always check your progress on the bar in the top of the screen!"
IDLPM,1. Promotor,1. Promoter
IDLTERM,4. Terminador,4. Terminator
WLKWL,Bienvenido al juego de Wetlab,Welcome to the game of Wetlab
IMJWL1,"¡Toca ponerse los guantes y empezar a trabajar! Sigue las instrucciones de Dropaula, la Jefa de Wetlab, para desarrollar los protocolos de digestión, ligación y transformación con el objetivo de obtener bacterias transformadas con el ADN que hemos sintetizado.","Let's put on the gloves and begin working! Follow the instructions given by the Wetlab boss, in order to execute the protocols of digestion, ligation and transformation, with the objective of getting bacteria transformed with the DNA that we have synthesized."
IMJWL2,"Pero, ¡cuidado! El tiempo apremia, así que trata de ser eficiente y completar correctamente los protocolos en el menor tiempo posible. ¡Mucha suerte!","But be careful, there is not much time, so try to be efficient and complete the protocols succesfully as fast as you can to win more points."
JWL1,"¡Ya veo que te has colocado frente al banco de trabajo! Vamos a comenzar entonces a hacer una digestión para cortar los fragmentos de ADN. ¿Ves todos esos tubos en la caja de hielo? Pues tienes que colocarlos en la gradilla, para que sea cómodo trabajar. Esos tubos contienen el ADN del plásmido y de los constructos que han diseñado los de Drylab, y también las enzimas de restricción necesarias para digerir este ADN en sitios específicos y el tampón para que funcione todo.","I see you’ve taken a site in front of the workbench! Let’s start by doing a digestion to cut out the DNA fragments. See all those tubes in the ice box? Well, you have to place them on the rack, so that it’s comfortable to work with. Those tubes contain the DNA from the plasmid and the constructs that the Drylab guys have designed, and also the restriction enzymes needed to digest this DNA at specific sites and the buffer to make it all work."
JWL2,"¡Excelente! Ahora, coge la pipeta roja, que sirve para medir microvolúmenes, y mezcla en las proporciones adecuadas cada uno de los reactivos. Tienes que hacer dos tubos para digerir por separado los constructos y el plásmido.","Excellent! Now take the red pipette, which is used to measure microvolumes, and mix the right proportion of each reagent. You need to make two tubes to digest the constructs and the plasmid separately."
JWL3,"Estupendo, veo que lo tienes ya hecho. Para digerir, sin embargo, hay que poner los tubos a 37 grados celsius, por lo que ahora colócalos en el termobloque, que permite alcanzar temperaturas estables. Además, luego vamos a inactivar las enzimas, que si no, ¡pueden seguir actuando!","Great, I see you’ve got it done. However, to digest you have to put the tubes at 37 degrees Celsius, so now put them in the thermoblock, which allows you to reach stable temperatures. Besides, we will then inactivate the enzymes, otherwise they will still be able to work!"
JWL4,"Ya lo has tenido el tiempo que tocaba, por lo que de nuevo hay que poner los tubos en el hielo.","You’ve had it for the right amount of time, so you have to put the tubes back on ice."
JWL5,"Como ves, hay dos tubos nuevos: una enzima ligasa y su tampón. Eso es porque vamos a unir las piezas de ADN digeridas a través de una ligación, para luego poder introducirlo en una bacteria. Pon, por favor, los cuatro tubos en la gradilla.","As you can see, there are two new tubes: an enzyme ligase and its buffer. That’s because we’re going to join the digested pieces of DNA together through ligation, so that we can then introduce it into a bacterium. Please put the four tubes in the rack."
JWL6,"Ahora de nuevo, mezclalo todo como te he enseñado antes, en las proporciones adecuadas.","Now mix everything as I have shown you, in the right proportions."
JWL7,¡Genial! Si esto es todo muy repetitivo… toca otra vez calentarlo para que la enzima pueda funcionar. Pon el tubo en el termobloque.,Great! If this is all too repetitive…it’s time to heat it up again so that the enzyme can work. Put the tube in the thermoblock.
JWL8,"Venga, ¿recuerdas ahora lo que hay que hacer? ¡Efectivamente! Saca el tubo del termobloque, pero esta vez, como lo vamos a usar en unos momentos, no hace falta que lo metas en hielo.","Come on, do you remember what to do? Yes, that 's right! Take the tube out of the thermoblock, but this time, as we’re going to use it in a few moments, you don’t need to put in ice."
JWL9,"Mira mira, qué rápido aprendes. Ya vamos a hacer lo último que toca: la transformación. Con esta, vamos a conseguir meter el ADN ya ligado en la bacteria. Fíjate, la caja de hielo que te tenía preparada tiene dos tubos dentro: uno son las bacterias competentes; es decir, bacterias que pueden tomar este ADN, y el otro es un tubo vacío para trabajar. Usa la pipeta amarilla para mezclar el ADN y las bacterias, y deja la mezcla de nuevo en hielo un ratito.","You learn so fast. Now we’re going to do the last thing we need to do: transformation. With this one, we’re going to get the bound DNA into the bacteria. Notice the ice box I had prepared for you has two tubes inside: one is the competent bacteria, a bacteria that can take up this DNA, and the other is an empty tube. Use the yellow pipette to mix the DNA and the bacteria, and leave the mixture back on ice for a while."
JWL10,"Ahora hay que asustarlas. Vamos a hacer un choque térmico para que así capten del medio el ADN y se transformen. Para eso, colócalas en el termobloque a 42 grados centígrados unos segundos.","Now we have to scare them. We’re going to give them a thermal shock so that they pick up the DNA from the environment and transform. To do this, place them in a thermoblock at 42 degrees Celsius for a few seconds."
JWL11,¡Rápido! Ahora vuelvelas a meter en hielo unos minutos más.,Quickly! Now put them back on ice for a few more minutes.
JWL12,"De mientras, puedes aprovechar para encender el mechero, porque vamos a trabajar en esterilidad. Esto es muy importante porque no queremos que se nos contamine la muestra.","Meanwhile, you can take the opportunity to turn on the lighter, because we are going to work in sterility. This is very important because we do not want to contaminate the sample."
JWL13,"Ahora, tienes que echarle 2YT, un medio rico para que las bacterias crezcan. Para ello, coge el medio del tarro esteril que lo contiene.","Now, you have to pour in 2YT, a rich medium for bacteria to grow. To do this, take the medium from the sterile jar."
JWL14,"Perfecto, ya lo tienes todo mezclado, pero ¡que no se te olvide apagar el mechero!","Perfect, you’ve got it all mixed up, but don’t forget to turn off the lighter!"
JWL15,"Bien, bien. Llegó el momento más tedioso de todos: esperar. Mete el tubo en el termobloque a 37 grados centígrados un buen rato y de mientras, aprovecha para hacer otras tareas, ¡que no hay tiempo que perder!","Good. The most tedious moment of all has arrived: waiting. Put the tube in the thermoblock at 37 degrees Celsius for a while. Meanwhile, take the opportunity to do other tasks, there is no time to waste!"
JWL16,"Ya ha pasado el tiempo, espero que lo hayas aprovechado para aprender, por ejemplo, cómo funcionan el resto de máquinas… porque ahora toca usar la centrífuga de sobremesa. Esta permite centrifugar pequeños tubos de forma cómoda, y poder así concentrar, por ejemplo, las bacterias, ya que las sedimenta sin matarlas.","The time has passed, I hope you have used it to learn, for example, how the other machines work… because now it’s time to use the benchtop centrifuge. This allows you to centrifuge small tubes comfortably, and thus concentrate bacteria, for example, as it sediments them without killing them."
JWL17,"Ahora cierra la tapadera y ponla a trabajar, ¡que si no pueden salir volando los tubos, y es peligroso!","Close the lid and power on, otherwise the tubes may fly out and that's dangerous!"
JWL18,"Ya ha terminado de centrifugar, así que ábrela con cuidado.","It has finished spinning, so pen it carefully."
JWL19,"¡Genial! Acércate el tubo, que te va a tocar sacar el exceso de sobrenadante, que es el líquido que hay dentro.","Great! Bring the tube closer, you’re going to have to remove the excess supernatant, which is the liquid inside."
JWL20,"¿Lo ves? Hay una mancha marrón en el fondo del tubo. Eso son las bacterias sedimentadas. Pues ahora quita volumen hasta que solo queden 100 microlitros, usando la pipeta azul.","Can you see it? There is a brown stain at the bottom of the tube. That 's the settled bacteria. Now remove the volume until there are only 100 microlitres left, using the blue pipette."
JWL21,"Ahora agita bien el tubo para que las bacterias se vuelvan a resuspender, hasta que sea todo de un color homogéneo.","Shake the tube well so that the bacteria resuspend again, until everything is homogeneous in color."
JWL22,"Como puedes observar, hay una especie de plato pequeño con gelatina en la esquina inferior derecha de la mesa. Eso es una placa petri, que sirve para cultivar bacterias, seleccionarlas, y que estas puedan crecer. Pues ahora tienes que echar las bacterias que has resuspendido ahí, pero vuelve a encender el mechero, que otra vez vamos a trabajar en esterilidad.","As you can see, there is a kind of small plate with gelatine in the bottom right corner of the table. that 's a petri dish, which is used to grow bacteria, select them and leave them grow. So now you have to put the bacteria that you have resuspended in there, but turn the lighter back on, because we are going to work in sterility again."
JWL23,"Venga, ahora sí, echa las bacterias sobre la placa con mucho cuidado para que no se nos contamine, que con el poco tiempo que queda, ¡sería un desastre!","Come on, pour the bacteria onto the plate very carefully so that it doesn’t get contaminated, because with so little time left, it would be a disaster!"
