id,es,en
BOT_JUG,Jugar,Play
BOT_SAL,Salir,Exit
BOT_VAJ,Volver a jugar,Play again
BOT_TER,Terminar,Finish
FDJ,Fin del Juego,End of the Game
PTS,Puntuación:,Points:
PTST,Puntuación total: ,Total points: 
JHFM,Fallaste más de la mitad de las preguntas :-(,You got half of your questions wrong :-(
JHFB,¡Muy bien! ¡Acertaste,Very good! You answer 
JHFB2,preguntas!,correctly!
JWFIN,¡Completastes el experimento correctamente!,You completed the experiment correctly!
WT1,"La biología sintética es una rama de la biología  que combina los principios de esta con los de la ingeniería para generar organismos o funciones que no existen en la naturaleza, con el objetivo de hacer frente a problemas que afectan a la sociedad. Para conseguir esto, los que trabajamos en biología sintética creamos y combinamos fragmentos de ADN para dar lugar a secuencias más complejas, llamadas construcciones genéticas, que contienen la información necesaria para que se realicen esas nuevas funciones.","Synthetic biology is a branch of biology that combines the principles of biology with those of engineering to generate organisms and/or functions that do not exist in nature, with the aim of addressing problems that affect society. To achieve this, those of us working in synthetic biology create and combine fragments of DNA to give rise to more complex sequences, called genetic constructs, which contain the information necessary for these new functions to be realised."
WT2,"El quorum sensing es un proceso mediante el cual las bacterias pueden comunicarse entre sí y regular algunas de sus actividades en función de la densidad de población de bacterias. Este fenómeno se basa en que las bacterias de determinadas especies producen y liberan unas moléculas que actúan como señales y que reciben el nombre de autoinductores. Cuando la densidad de la población es baja y hay pocas bacterias produciendo estas moléculas, no hay suficiente concentración y no se genera ninguna respuesta por parte de las células.","Quorum sensing is a process by which bacteria can communicate with each other and regulate some of their activities depending on the bacterial population density. This phenomenon is based on the fact that bacteria of certain species produce and release molecules that act as signals and are called autoinducers. When the population density is low and there are few bacteria producing these molecules, there is not enough concentration and no response is generated by the cells. "
WT3,"Las enzimas de restricción son proteínas que tienen la capacidad de cortar el ADN sobre secuencias específicas. Por ejemplo, la enzima EcoRI corta siempre que encuentre la secuencia GAATTC en el ADN. Las enzimas de restricción forman parte de un sistema de defensa de las bacterias contra los virus. Sin embargo, pronto los investigadores las han aplicado a la ingeniería genética, al ser capaces de cortar fragmentos de ADN dejando en ellos extremos que permiten unir unas secuencias con otras de forma específica.","Restriction enzymes are proteins that have the ability to cut DNA at specific sequences. For example, the EcoRI enzyme cuts whenever it finds the sequence GAATTC in DNA. Restriction enzymes are part of a bacterial defence system against viruses. However, researchers have soon applied them to genetic engineering, as they are able to cut fragments of DNA, leaving DNA ends that allow sequences to be linked to other sequences in a specific way."
WT4,"Los stakeholders son las personas o entidades interesadas en un proyecto, y además, apoyan ya sea dando recursos o información, principalmente. Para desarrollar un proyecto de biología sintética adecuado y que realmente busque hacer frente a problemáticas sociales, es necesario hablar con todas estas personas. Así podremos ir conociendo sus necesidades reales a lo largo del desarrollo del proyecto e ir amoldandonos a ellas.","The stakeholders are the people or entities interested in a project, and also, they support them either by giving them resources or information, mainly. In order to develop an adequate synthetic biology project that really seeks to address social problems, it is necessary to talk to all these people. In this way we can get to know their real needs throughout the development of the project and adapt to them."
WT5,"El ADN es la molécula en la que todos los seres vivos almacenan su información genética, información necesaria para su desarrollo. A su vez, el ADN está formado por una sucesión de otras moléculas: los nucleótidos, que contienen cada uno una base nitrogenada. Hay 4 tipos de nucleótidos en función de la base nitrogenada que presenten: nucleótidos de adenina (A), timina (T), citosina (C) y guanina (G). Toda la información de las células se almacena por combinación de tan solo estas 4 letras.","DNA is the molecule in which all living beings store their genetic information, information necessary for their development. In turn, DNA is made up of a succession of other molecules: nucleotides, each containing a nitrogenous base. There are 4 types of nucleotides depending on the nitrogenous base they contain: adenine (A), thymine (T), cytosine (C) and guanine (G) nucleotides. All the information of the cells is stored by a combination of only these 4 letters."
WT6,"La expresión génica es el proceso por el que las células emplean la información del ADN para la producción de proteínas específicas. Estas son las moléculas responsables de realizar la mayor parte de las funciones celulares. La expresión génica tiene dos fases esenciales: la primera es la transcripción, en la que se genera una copia del ADN en forma de ARN y la siguiente es la traducción, en la que el ARN, gracias a los ribosomas, se utiliza para generar una proteína.","Gene expression is the process by which cells use information from DNA to produce specific proteins. These are the molecules responsible for carrying out most cellular functions. Gene expression has two essential phases: the first is transcription, in which a copy of the DNA is generated in the form of RNA, and the next is translation, in which the RNA, thanks to the ribosomes, is used to generate a protein."
WP1,Tubos,Tubes
WP2,Microscopio,Microscope
WP3,Placa Petri,Petri dish
WP4,Pizarra,Whiteboard
WP5,Usando pipeta,Using pipette
WP6,Vasos,Glasses
WF1,"Fina, a mano","Fine, handwritten"
WF2,Tiza,Chalk
WF3,"Gruesa, comic","Thick, comic"
WF4,Arial,Arial
JWI,Imagen: ,Image: 
JWF,Fuente: ,Font: 
TITULO,LOS MOHOCYTOS,THE MOHOCYTES
SUBTITULO,UNA EXPERIENCIA EN BIOLÓGICA SINTÉTICA,A SYNBIO EXPERIENCE
PAS1,Este eres tú.,This is you.
PAS2,Estás muy emocionado porque es tu primer día trabajando en un proyecto.,You’re very excited because it’s your first day working on a project.
PAS3,"Sabes que el proyecto es sobre biología sintética, y que se presentará a una competición.","You know that the project is about synthetic biology, and that it will be entered into a competition."
PAS4,Y estás bastante seguro de que la biología sintética es una rama muy novedosa de la biología.,And you're pretty sure that synthetic biology is a very new branch of biology.
PAS5,"Pero más allá de eso, estás un poco perdido.","But beyond that, you're a bit lost."
PAS6,"¡Aun así, estás lleno de ganas de trabajar e instruirte!","Still, you're full of desire to work and educate yourself!"
PAS7,"(Mmmm, este tiene que ser el sitio.)","(Mmmm, this has to be the place.)"
PAS8,"(Es verdad que me inscribí en este proyecto de biología sintética porque sonaba interesante, pero ando un poco perdido.)","(It's true that I signed up for this synthetic biology project because it sounded interesting, but I'm a bit lost.)"
PAS9,(Por ahora no veo a nadie…),(I don’t see anyone at the moment…)
PAS10,"(Tal vez podría acercarme a esa habitación de ahí, a ver si alguien me puede guiar un poco.)","(Maybe I could go over to that room over there, see if someone can help me a little bit.)"
PAS11,"Debería ir a la Gran Final, que me están esperando.","I should go to the Grand Final, they are waiting for me."
PAS12,Creo que primero investigaré esa puerta rosa...,I think I will go through that pink door…
PAS13,¡Ahora no es el momento de ponerme a explorar!,Now it’s not the time to explore this hall!
PAS14,Debería llevar esto a Wetlab.,I should bring this to Wetlab.
PAS15,¡Tengo que demostrar mis conocimientos al jefe de Human Practices!,I have to demonstrate my knowledge to the leader of Human Practices.
PAS16,Antes debería hablar con los miembros de Redes Sociales.,I should talk to the members of Social Media.
PAS17,¡No hay tiempo!,There is no time!
PAS18,Tengo que hablar con los de Wiki,I have to talk to Wiki.
H1,¡Rápido! ¡Rápido! ¡RÁPIDO!,Come on! Hurry up!
H2,¡Aseguraos de que esté todo bien!,Make sure everything is alright!
H3,"¡Vamos tan rápido como podemos, pero no hay tiempo!","We're going as fast as we can, but there's no time!"
H4,"(Ups, parece que no he llegado en un buen momento…)","(Oops, It doesn’t seem to have come at a good time…)"
H5,"(Voy a hablar con esa persona de ahí, parece que es la que dirige todo esto.)","(I'm going to talk to that person over there, she seems to be the one running this whole thing.)"
H6,¿Ves como no era para tanto?,See how it was no big deal?
H7,"Lo has hecho genial, si es que eres casi un experto en biología sintética.","You did great, you're almost an expert in synthetic biology."
H8,¿Tú crees?,You think so?
H9,¡Claro que sí!,Of course I do!
H10,Creo que ya va siendo hora de que te añadamos a la página web como miembro oficial del equipo.,I think it's time to add you to the website as an official member of the team.
H11,¿Por qué no te pasas a hablar con el área de Redes Sociales?,Why don't you talk to the Social Networks area?
H12,¡Ya estás de vuelta!,You're back!
H13,¿Te han explicado lo que es la biología sintética?,Did they explain to you what synthetic biology is?
H14,Así es.,That's right.
H15,Mmmmmm…,Mmmmmm…
H16,Ya verás como se les ha olvidado decirte algo esencial...,You'll see they forgot to tell you something essential...
H17,¿¿??,¿¿??
H18,¿Me sabrías decir para qué sirve lo que hacemos en Human Practices?,Can you tell me what is the purpose of what we do at Human Practices?
H19,"Pues eeh… algo han mencionado de que la biología sintética suele tener carácter social, pero poco más…","Well eeh... they mentioned that synthetic biology tends to have a social character, but not much more..."
H20,¡Si es que ya lo sabía yo!,But I already knew that!
H21,Human Practices se encarga de la parte más social de la biología sintética:,Human Practices deals with the more social side of synthetic biology:
H22,"buscamos conocer cómo el problema que tratamos afecta a las personas,","we seek to understand how the problem we are dealing with affects people,"
H23,"animándolas a que nos aporten ideas que servirán para luego modificar o complementar el trabajo que realizamos, generando un cambio significativo en él.","encouraging them to provide us with ideas that will later serve to modify or complement the work we do, generating a significant change in it."
H24,Obtener esta información es importante ya que es nuestra forma de acercarnos al impacto real que podría tener nuestro proyecto en la sociedad y el mercado.,Obtaining this information is important as it is our way of getting closer to the real impact that our project could have on society and the market.
H25,En ocasiones conseguimos que empresas o entidades se sumen a la causa y nos apoyen facilitándonos información y recursos.,Sometimes we get companies or organisations to join the cause and support us by providing us with information and resources.
H26,"Además, también es vital que el trabajo que hacemos llegue a todo el mundo;","In addition, it is also vital that the work we do reaches everyone;"
H27,"buscamos que cualquier persona, independientemente de sus circunstancias sociales o personales, tenga acceso a estos conocimientos.","we want anyone, regardless of their social or personal circumstances, to have access to this knowledge,"
H28,¡Así nadie se queda sin entender algún concepto!,so that no one is left without understanding a concept!
H29,¡Increíble! Hacéis una gran labor de integración.,Incredible! You do a great job of integration.
H30,"¡Efectivamente! Si no hiciéramos este trabajo, no tendría sentido nada de lo que hacemos con la biología sintética.","That's right! If we didn't do this work, nothing we do with synthetic biology would make sense."
H31,"Por cierto, ya que estás aquí, ¿por qué no me ayudas a divulgar información sobre este tema tan importante?","By the way, while you're here, why don't you help me disseminate information on this important subject?"
H32,"(Madre mía, y yo que pensaba que vendría a ayudar en un área, ¡y resulta que trabajo en todas!)","(My goodness, I thought I was coming to help in one area, and it turns out I work in all of them!)"
H33,¿Ahora?,Now?
H34,¡Ahora mismo!,Right now!
H35,"Teníamos una presentación con una escuela, y la iba a cancelar porque tengo una reunión con un stakeholder y no tengo tiempo...",We had a presentation with a school I was going to cancel because I have a stakeholder meeting and I don't have time....
H36,"¡Pero ahora que sabes tanto, la puedes dar tú!","But now that you know so much, you can give it!"
H37,Supongo que podría hacerlo… pero ¿qué es eso de un stakeholder?,I suppose I could do it... but what is this stakeholder thing?
H38,"¡Es verdad, que no estás puesto en la jerga!","That's right, you're not up on the slang!"
H39,"Me llevaría un rato explicártelo bien, pero grosso modo, son las personas y empresas a las que les interesa en lo que trabajamos.",They are peaple that are very interested in our project.
H40,"Si quieres, luego le preguntas a alguno de mis compañeros, que seguro que te lo dicen encantados.","If you want, ask one of my colleagues later, they'll be happy to tell you."
H41,Háblame de nuevo cuando estés listo. ¡Ya verás como va a salir genial!,"Talk to me again when you're ready, you'll see how great it's going to be!"
H42,(Espero dar la talla…),(I hope I'm up to the task...)
H43,"¡Oh! Tú debes ser el nuevo, ¿no?","Oh! You must be the new guy, right?"
H44,"Así es, ¡encantado!","That's right, nice to meet you!"
H45,"Si no es mucha molestia, ¿podría preguntar por qué estáis tan alborotados?","If it's not too much trouble, could I ask why you're all in such a hurry?"
H46,"¡Claro claro, no es molestia alguna!","Of course, it's no bother at all!"
H47,"Es que mira, resulta que nos van a descalificar de la competición.",It's just that it turns out we're going to be disqualified from the competition.
H48,¡Ahh! Entiendo.,Ahh! I see.
H49,...,…
H50,¿Perdón?,Excuse me?
H51,"Como oyes, al parecer ha habido un fallo de comunicación con la fecha de entrega.","As you can hear, there seems to have been a miscommunication with the delivery date."
H52,¿Cuándo esperabais entregar el proyecto?,When did you expect to deliver the project?
H53,En 2 meses.,In 2 months.
H54,¿Y cuando se entrega?,And when is it due?
H55,En 15 minutos.,In 15 minutes.
H56,...,…
H57,"Bueno, un fallo lo tiene cualquiera.","Well, anyone can make a mistake."
H58,"Un placer conoceros, espero que podamos trabajar juntos en un futuro proyecto.","Nice to meet you, I hope we can work together on a future project."
H59,Os deseo buena suert-,I wish you good luck…
H60,"En ese momento empiezas a irte, pero notas como él te agarra del brazo.","When you start to leave, you notice how he grabs your arm."
H61,"¡OYE! Ya que estás aquí, ¿por qué no te quedas y nos echas una mano?","Hey, while you're here, why don't you stay and give us a hand?"
H62,"¡Sólo te costará 15 minutos! Sé que parece poco tiempo, pero menos es nada… y cuanta más gente participe, ¡mejor!","It willl only take 15 minutes! I know it seems like a short time, but less is nothing... and the more people involved, the better!"
H63,"E-Eh... B-bueno… Yo venía con esa intención, así que es verdad que podría aprender mucho…","E-Eh... W-well... I came with that in mind, so it's true that I could learn a lot..."
H64,"¡Pues claro! ¡Ya verás como si nos esforzamos, podremos entregar el proyecto a tiempo!","Of course! You'll see, if we work hard, we'll be able to deliver the project on time!"
H65,"¡G-Genial! Pero no tengo ni idea de por dónde empezar, ¿qué podría hacer?","G-Great! But I have no idea where to start, what could I do?"
H66,Mmmmm…,Mmmmm…
H67,"Pues mira, resulta que nosotros somos un equipo muy multidisciplinar… bueno, ¿conoces el concepto de multidisciplinariedad?","Well look, we are a very multidisciplinary team... well, you know the concept of multidisciplinarity?"
H68,Eso es cuando dentro de un equipo hay gente con distintas especialidades ¿no?,"That's when within a team there are people with different specialities, isn't it?"
H69,"Algo así, la multidisciplinariedad es cuando personas que trabajan en muchos ámbitos distintos se unen para poner en común el conocimiento de sus respectivas áreas y desarrollar un trabajo conjunto.","Something like that, multidisciplinarity means that people working in many different fields come together to share the knowledge of their respective areas and develop joint work."
H70,"De esta forma, hay un gran intercambio de ideas y perspectivas que genera un entorno de trabajo muy enriquecedor y da lugar a propuestas más innovadoras.","In this way, there is a great exchange of ideas and perspectives that generates a very enriching work environment and leads to more innovative proposals."
H71,"La biología sintética cada vez trabaja más con equipos multidisciplinares, y en nuestro caso, el grupo lo forman cinco ámbitos: Drylab , Wetlab, Human Practices, Redes Sociales y Wiki.","Synthetic biology is increasingly working with multidisciplinary teams, and in our case, the group is made up of five areas: Drylab, Wetlab, Human Practices, Social Networks and Wiki."
H72,Yo dirijo Human Practices. Te explicaría en qué consiste pero ahora mismo no tengo mucho tiempo…,I run Human Practices. I'd explain what it's all about but I don't have much time right now...
H73,¿Y si mejor empiezas por aprender bien los fundamentos de la biología sintética?,Why don't you start by learning the basics of synthetic biology?
H74,¿Por qué no te acercas a la habitación de Drylab?,Why don't you go to Drylab room?
H75,Ellos te lo explicarán mejor que yo.,They will explain it better than I can.
H76,"¡Venga, ya veras como si trabajamos todos juntos lo conseguimos!","Come on, you'll see, if we all work together we can do it!"
H77,¿Listo?,Ready?
H78,¡Pues al lío!,Let's get on with it!
H79,Deberías hablar con los de Redes Sociales para que te añadan como miembro.,You should talk to Social Networks about being added as a member.
H80,¡Esto es un desastre!,This is a disaster!
H81,"¡Encantado de conocerte, nuevo!","Nice to meet you, newbie!"
H82,¿Estás nervioso por la charla?,Are you nervous about the talk?
H83,¡No te preocupes tanto!,Don't worry so much!
H84,Tú recuerda lo que has aprendido hasta ahora.,You remember what you have learned so far.
H85,¡Lo has hecho genial en la presentación!,You did great in the presentation!
H86,¡Nadie diría que llevas menos de 15 minutos en el equipo!,No one would say you've been on the team for less than 15 minutes!
H87,¡Meses de trabajo en vano!,Months of work for nothing!
H88,¿Te acabas de meter en el proyecto? ¡A buenas horas!,Did you just get on the project? Good timing!
H89,"Después de hablar tantas veces ante un público, ya no me pongo nervioso.","After speaking so many times in front of an audience, I don't get nervous anymore."
H90,¡Pero recuerdo que la primera vez me temblaban las piernas!,But I remember the first time my legs were shaking!
H91,¿Te apetece aprender sobre los stakeholders?,You wanna learn about stakeholders?
H92,"Como te habrá dicho el jefe, los stakeholders son las personas o entidades interesadas en el proyecto que hacemos, y además, nos apoyan ya sea dándonos recursos o información, principalmente.","As the boss must have told you, the stakeholders are the people or entities interested in the project we do, and also, they support us either by giving us resources or information, mainly."
H93,"Para desarrollar un proyecto de biología sintética adecuado y que realmente busque hacer frente a problemáticas sociales, es necesario hablar con todas estas personas.","In order to develop an adequate synthetic biology project that really seeks to address social problems, it is necessary to talk to all these people."
H94,Así podremos ir conociendo sus necesidades reales a lo largo del desarrollo del proyecto e ir amoldándonos a ellas.,In this way we can get to know their real needs throughout the development of the project and adapt to them.
H95,"Como habrás visto antes, el jefe tenía que hablar con uno de ellos. Ese es el trabajo que nos toca hacer casi a diario,","As you may have seen before, the boss had to talk to one of them. That's the job we have to do almost every day,"
H96,ya que solo así podremos asegurarnos de que estamos haciendo un buen trabajo recopilando e integrando la información.,because that's the only way we can make sure we are doing a good job gathering and integrating the information.
H97,"Y tengo que añadir que, si hay suerte, a veces deciden apoyar los proyectos económicamente, que como sabrás, hacer ciencia no es barato…","And I have to add that, if we are lucky, sometimes they decide to support the projects financially, which as you know, doing science is not cheap...."
H98,¡Espero haberte ayudado!,I hope I helped you!
H99,¡Ohhh! No imaginaba lo importante que era hablar con los grupos de interés para hacer biología sintética de calidad.,Ohhh! I didn't realise how important it was to talk to stakeholders to do quality synthetic biology.
H100,¡Gracias!,Thanks!
H101,Está bien. Habla conmigo si cambias de opinión.,That's fine. Talk to me if you change your mind.
R1,Creo que esta es la sala correcta…,I think this is the right room...
R2,¡Bueno bueno bueno!,Well well well!
R3,¿Pero a quién tenemos aquí?,But who do we have here?
R4,No recuerdo haberte visto antes.,I don't remember seeing you before.
R5,E-es que soy el nuevo miembro del equipo…,I-I'm the newest member of the team...
R6,¡Aaaaaah! Eso lo explica todo.,Aaaaaaaah! That explains everything.
R7,* FLASH *,* FLASH *
R8,¡A-auu! No estaba preparado para el flash…,Auch! I was not expecting a flash.
R9,"No te quejes, que sales muy bien.","A-wow, I wasn't prepared for the flash..."
R10,"Dejame un momento, que tengo que pasarle esto a los de Wiki para que te añadan.","Give me a moment, I have to pass this on to Wiki so they can add you."
R11,"De mientras, ¿porqué no hablas con los otros miembros de Redes Sociales?","In the meantime, why don't you talk to the other members of Social Networks?"
R12,"Estoy ocupada ahora mismo cariño, háblame otra vez en 5 minutillos.","I'm busy right now honey, talk to me again in 5 minutes."
R13,¡Ya está!,That's it!
R14,Ahora estás oficialmente reconocido como un miembro en todas las redes sociales y la web de nuestro equipo.,You are now officially recognised as a member on all social media and our team website.
R15,¡Muchas gracias!,Thank you very much!
R16,"Bueno, si no necesit-","Well, if I didn't need to-"
R17,¡SÍ! ¡HA SALIDO BIEN!,YES! IT WENT WELL!
R18,¿Qué ha sido eso?,What was that?
R19,Creo que sé quién es…,I think I know who that is...
R20,¡Nuevo! ¡No te lo vas a creer!,Newbie! You won't believe it!
R21,¿Ha salido bien lo que hicimos?,Did what we did go well?
R22,¡Así es!,It did!
R23,(Pues sí que ha tardado poco.),"(Well, it didn't take long.)"
R24,Ahora solo hay que pasarle la información a los de Wiki y…,Now all we have to do is give the information to the Wiki people and...
R25,…,…
R26,¿Qué ha pasado?,What happened?
R27,¡Solo quedan 5 minutos!,Only 5 minutes left!
R28,¡Rápido nuevo! ¿Puedes llevarle este pendrive a los de Wiki? Tiene los documentos con la información que hemos redactado todos.,"Quickly, can you take this flash drive to the Wiki people? It has the documents with the information we have all written on it."
R29,¡Ya casi hemos acabado!,We're almost done!
R30,¡Solo queda un último esfuerzo!,There's only one last effort left!
R31,¡Hola!,Hi!
R32,"Doy por hecho que quieres saber lo que hacemos en Redes Sociales, ¿verdad?","I assume you want to know what we do on Social Networks, right?"
R33,"Pues mira cielo, nosotros somos una subárea de Human Practices pero con un trabajo muy especializado:","Well, look honey, we are a sub-area of Human Practices but with a very specialised job:"
R34,nos encargamos de difundir el trabajo que hacemos en el equipo y divulgar sobre muchos tópicos científicos de interés haciendo uso de las nuevas tecnologías.,we are in charge of disseminating the work we do in the team and spreading the word about many scientific topics of interest using new technologies.
R35,"Al final, por mucho que trabajemos en temas tan específicos, necesitamos generar un engagement a través de un contenido interactivo y novedoso,","In the end, as much as we work on very specific topics, we need to generate engagement through interactive and innovative content,"
R36,que haga que la gente se interese por nuestras cuentas y nos siga.,which makes people interested in our accounts and follow us.
R37,"Sin embargo, por supuesto también buscamos enseñar y educar en biología sintética, la base de nuestro proyecto.","However, of course we also seek to teach and educate in synthetic biology, the basis of our project."
